utterance,expected
could i schedule a viewing,tourBooking
Did you rent out #5 yet?..its been posted off the market,tourBooking
do -PRON- guy do in person tour,tourBooking
Do you have any times on Friday?,tourBooking
Do you have any tours available the 23rd?,tourBooking
Do you have anything available today?,tourBooking
Do you have tour availability next Saturday,tourBooking
Do you schedule tours for the Jekyll building as well?,tourBooking
Friday works! I'm a chef so work early morning at 6 till 2:30 so Friday works!,tourBooking
"Friday, 10:30Am",tourBooking
"Good afternoon if I would like, tell me at what time and the address",tourBooking
"Good morning sorry for the delayed response but yes would like to schedule a tour, preferably tomorrow",tourBooking
"Great!
I have to check my schedule to see when I can come, my daughter doesn't get out of school until 4pm Monday-Friday",tourBooking
hello can i see the estudio tomorrow like at 12 am,tourBooking
hello Ryan thank you for your attention ok I am free that Saturday or Sunday if possible I would like to visit thank you.,tourBooking
"Hello Ryan,
Yes, I would like to schedule a tour. Are there any time slots for tomorrow after 3.30 pm or for Sunday?",tourBooking
"Hello Ryan, I would like to schedule for Tuesday's or Wednesday.",tourBooking
"Hello Ryan, is the 6:00pm appt for the moving still available for tomorrow???",tourBooking
Hello Ryan! Thank you for getting back to me! I would love to schedule a tour for this Friday or the following if you're available,tourBooking
"Hello Ryan! Thank you for reaching out. I would love to schedule a showing. I can do this evening if possible, or anytime this weekend.",tourBooking
"Hello, I have the tour schedule it for 2/9 at 6 pm",tourBooking
"Hello, I stuck at a meeting. Do you have any availability over the weekend ?",tourBooking
"Hello, I would like to schedule a tour for Saturday 13, I would like to see studio #302",tourBooking
"Hello,This Is Lee. I Don't Remember Where Your Apartments Are Located, Perhaps Next Tuesday I Could Come To View The Apartments In Question?",tourBooking
"Hey Ryan, thank you i am doing well and hoping the same for you. yes i would love to schedule a tour. when are you available?",tourBooking
Hey Ryan! I hope you are as well! Yes I'd like to schedule a tour. I was wondering also the availability of a 3 bed room - is that something you have?,tourBooking
Hey! Yup. I believe I booked a tour for Saturday. Did that come through on your end,tourBooking
"Hi I am, however I currently live in the Sacramento area so I would need to go next weekend if that's possible?",tourBooking
Hi I'm not available Saturday I work until 5:45,tourBooking
"Hi Kelsey, I can take a look at the apartment in a couple weeks.",tourBooking
"Hi Kelsey, thanks for reaching out to me. I will be in Houston on Friday and was wondering if there where any available tour's and at what time.",tourBooking
Hi Kelsey. Thank you for reaching out. I would like to tour the apartment on Thursday at 2pm. An in-person tour would be best for me,tourBooking
"Hi Ryan, sorry I need to reschedule the tour, would it be possible tomorrow morning?",tourBooking
"Hi Ryan, thanks for reaching out. I would like to schedule a tour. Any chance that tomorrow morning would work?",tourBooking
"Hi Ryan, thanks for responding! I would like to schedule a tour. I am free any time on Friday.",tourBooking
"Hi Ryan, to thanks for texting me. Yeah, I'd like to schedule a tour and see the place, I'm available on weekends. Let me know a good time for you.",tourBooking
"Hi Ryan, yes I would like to schedule a tour",tourBooking
"Hi Ryan, yes I would like to schedule a tour but could we do Thursday instead? Thank you for getting back to me",tourBooking
"Hi Ryan, yes I would like to schedule the tour for Thursday afternoon, ok?",tourBooking
"Hi Ryan, yes please I would like to set up a tour of the property.",tourBooking
hi ryan! i'd like to schedule a viewing for today,tourBooking
Hi Ryan! Thanks for a prompt repsonse. I would like to schedule a tour. Do you have any availability on the upcoming friday?,tourBooking
Hi Ryan! We spoke earlier and booked a tour for Monday at 1 pm :),tourBooking
Hi Ryan. I would like to schedule a tour. Is Wednesday afternoon or night works?,tourBooking
Hi Ryan. Thanks for reaching out! I am in LA and won't be able to come up to the Bay. I won't be moving until June and wanted to get a head start looking at buildings. I'd love to keep your contact and reach out in May if that's okay with you!,tourBooking
"Hi Ryan. Yes, my roommate and I would love to schedule a tour. Does Sunday work?",tourBooking
Hi so I scheduled a tour and it's supposedly at this time. What number would I reach them at?,tourBooking
Hi there. Yes I will be there at 4pm for my tour today. Thank you,tourBooking
Hi yes I Would like to schedule,tourBooking
hi yes i would like to schedule a tour,tourBooking
"Hi, can I visit the studio (1,175/mo) on Thuesday or Wednesday after 7pm?",tourBooking
"Hi, my job temporarily shut down till Tuesday for some maintenance, any availability for a tour before then starting tomorrow ?",tourBooking
how do i book a tour,tourBooking
"Hy Ryan, I would like to schedule a tour on saturday at 4pm.",tourBooking
I am available Friday at 2:30pm. Would that work?,tourBooking
I am trying to come out to look at apartments in may. Definitely!,tourBooking
"I can come now, if you guys are ok",tourBooking
I could try to do Saturday afternoon.,tourBooking
I do apologize for the late response. I am at work. But I was specifically interested in seeing unit #05 that I saw advertised for $1195 per month.,tourBooking
I have time tomorrow and Wednesday-,tourBooking
I just booked it actually!,tourBooking
I like person tour,tourBooking
I like this property because it's only $765 I think dont quote me lol,tourBooking
I said 8:00pm don't believe you heard me correct I can do that time sun,tourBooking
I understand thank you. Can I come in this Friday at 4pm?,tourBooking
i want to book a tour,tourBooking
I want to book a tour.,tourBooking
i want to schedule a tour,tourBooking
"i want to schedule a tour
VK",tourBooking
I want to stop by today,tourBooking
I was hoping to take a look today. Is that possible?,tourBooking
I work all day Saturday so sadly that doesn't work for me.,tourBooking
I would like to do you have anything available on Sunday?,tourBooking
I would like to schedule a tour,tourBooking
I would like to schedule a tour for next Friday April 1st,tourBooking
"I would like to see the 2 bedroom place on Thursday, please.",tourBooking
"I would like to yes. Monday - Thursday after 5pm is when my wife and I would be available, is there a time next week that schedule might work?",tourBooking
I would love to schedule a tour. What time would be best?,tourBooking
I would love to schedule an tour,tourBooking
I'd love to come take a look at the property today what time you'll be in till,tourBooking
I'd love to set up a time to go look at this property,tourBooking
"I'll be available after 3:30 - 4pm, if that's alright",tourBooking
I'll see if I can go tomorrow aftrr work,tourBooking
I'm available today or Friday afternoon or any time next weekend,tourBooking
I'm getting ready to go back into work now I would like to talk to you at some point,tourBooking
I'm looking for a may move in so if you don't get it rented by then,tourBooking
I'm not available on the weekend,tourBooking
I'm sorry I'm going to look at the list again and let you know which one I decide to tour.,tourBooking
Is Saturday April 9th at 1pm a good time?,tourBooking
Is the tour tomorrow at 6:00 for #306 or #406 1461 Alice or both?,tourBooking
Just the tour,tourBooking
March 12 will do fine and thanks for asking I'm doing good I look forward to seeing the places the 12th,tourBooking
March 6th at 2:00pm works for me,tourBooking
Monday works great,tourBooking
Needs to be on the 19th,tourBooking
No Thursday is fine but can it be an earlier time?,tourBooking
Oh can we look at all of those apt? They're all same price po dba?,tourBooking
Ok I will be willing to take a tour on Monday morning I will message tomorrow,tourBooking
Ok I will come today Mar 6:00PM up to 7:00 pm,tourBooking
Ok i will come tomorrow mar 09 2021 6:00PM.,tourBooking
Okay so may I see both the studio and 1 bedroom,tourBooking
Okay thanks! Do you have availability next Thursday afternoon?,tourBooking
or actually the weekend of the 19th/20th would be better,tourBooking
"Quick question, were you talking about today or tomorrow for the 3:30 tour?",tourBooking
"Sat Feb 27, 2-2:30 is good!",tourBooking
Saturday 10:00am,tourBooking
Saturday Mar 06 3:00 PM works,tourBooking
saturday works,tourBooking
schedule a tour,tourBooking
"Sorry for switching on you, but Thursday at 6 will actually work better for me! Thanks so much!",tourBooking
"Sorry, actually 6pm works for me on Thursday",tourBooking
Sunday works for me,tourBooking
Sunday would work too :),tourBooking
Thank u I have my appt with him tomarrow I hope he gets the voicemail I cant get there until 3 30 instead of noon time thanks again,tourBooking
Thank you for contacting me. If possible Can we schedule a tour for Thursday or Friday. Thank you,tourBooking
Thank you for reaching out to me I just set up an tour for the 13th,tourBooking
"Thank you Ryan. Yes, it would be better if I could have a schedule.",tourBooking
"Thanks for the reply I will definitely be there at 5pm on Tuesday February 16th to meet with Mr. Gothberg, and thank you for your time Kenneth Quivers",tourBooking
"Thanks! That sounds great!
Thursday works-I believe the time was 5pm on the listing?",tourBooking
That would be awesome! Wednesday afternoon works best for me.,tourBooking
That would be great. When would be a good time for you?,tourBooking
"That's work for me, i will be there at 4:00",tourBooking
The day is fine for me can we schedule the tour and you can help me to fill up the application I try to but I am missing some spots,tourBooking
The time on Thursday Mar 4 actually works,tourBooking
Thursday 6 is good 👍,tourBooking
Today would be great for 11am,tourBooking
tomorrow 3 pm,tourBooking
Tour,tourBooking
Unfortunately for both my roommate and I are students and cannot schedule a tour for tomorrow. Do you have any time on Wednesday 03/10 perhaps?,tourBooking
"We can do tomorrow 5:30-6:30. Sorry I keep missing your calls. I'm at work. Should I text, call or just show up at that time?",tourBooking
We can schedule a tour .,tourBooking
We didn't get a notification or text or call we waited for the tour but wasn't givin any information how to do it,tourBooking
Wed Feb 17 11.30 am works for me,tourBooking
Wednesday work for u?,tourBooking
What about next Thursday?,tourBooking
What's the name of the place? And I would like to set up a tour,tourBooking
when can i come to see the place,tourBooking
Will be available tomorrow morning 10am. Thank you for your response,tourBooking
Would I be able to make another appointment for another day?,tourBooking
Would like a tour yes,tourBooking
"Yeah, I sure would. Thanks Ryan. Would 4pm work?",tourBooking
"yeah, tomorrow 3 pm works for me",tourBooking
yes but i'll have time again on Friday will get you back,tourBooking
"Yes I do like to have a tour
But I am in Houstan only for today and Saturday, please let me know if you can show me the property. Thanks Raza",tourBooking
Yes I would like a tour.,tourBooking
Yes I would like to schedule a tour,tourBooking
Yes I would like to schedule a tour but I also have a couple questions how long is the lease and how much is the rent?,tourBooking
Yes I would like to schedule a tour do you have any available,tourBooking
"Yes I would like to schedule at your, thanks for getting back to me. Is any time tomorrow available?",tourBooking
Yes I would love to schedule a tour and I do have a few questions,tourBooking
Yes Let's schedule a tour,tourBooking
Yes one for tomorrow at 2 o'clock,tourBooking
"Yes, I'd like to schedule a tour.",tourBooking
"Yes, I'll do Friday at 9 AM.",tourBooking
"Yes, please tomorrow 2pm is good for me",tourBooking
"Yes, please tomorrow 3pm is good for me",tourBooking
"Yes, would like to schedule a tour. I close from work at 5:30 p.m. Will be available after work. 
Thanks.",tourBooking
Yes! A tour would be great. Do you have any availabilities the week of April 5-11?,tourBooking
Yes. Schedule a tour tomorrow,tourBooking
"You mentioned tomorrow, is that still an option? If not, yes please register me for Saturday. I am very interested in seeing the place.",tourBooking
"Actually, I would like to cancel the tour, thank you.",tourCancellation
"Apologies. It's been hectic the past couple of days. I did, however, find another apartment, so I'd like to cancel my tour. Apologies again for the late response.",tourCancellation
Can we cancel it?,tourCancellation
Can you cancel I apologize for the inconvenience. I'll reschedule on my own.,tourCancellation
Can you cancel my tour,tourCancellation
Can you cancel my visit?,tourCancellation
cancel my appointment,tourCancellation
cancel my tour,tourCancellation
cancel the tour,tourCancellation
cancel tour,tourCancellation
Good Morning I am so sorry I have to cancel I was supposed to tell on Thursday I was so busy I would love to next Saturday I will be on that side of town Noon the same time 6/11 I am so sorry about the inconvenience,tourCancellation
"Hello ,its Benji, I'm sorry to inform you but I'll have to cancel the appointment due to something out of my control occuring. Sorry",tourCancellation
"Hello, I am very sorry but I would like to cancel the tour for personal reasons.",tourCancellation
"Hello, I have to cancel so sorry missed my flight",tourCancellation
"Hello! I'm so sorry but I'm gonna have to cancel, something came up and I'm not gonna be able to make it",tourCancellation
Hello. I'm not able to make appointment today.,tourCancellation
Hello. This is Woohyun. I think I'm going to have to cancel this appointment because I decided to go somewhere else this morning. I'm very sorry.,tourCancellation
"Hey Kelsey! I'm sorry, I tried to cancel it to avoid anyone waiting around on me! I'm from Georgia and can't tour in Texas. I think that the tour was scheduled ""just in case"" but I'm not in town!",tourCancellation
"Hey! I talked with the property assistant manager Jeanette and she got my squared away with an apartment with The Pointe, so we cancel the tour",tourCancellation
"Hi I need to cancel. I won't be able make it down. I'm an hour and
A half away and have to work tomorrow",tourCancellation
Hi my tour was cancelled because you guys said the unit is no longer available,tourCancellation
"Hi, good morning I have to cancel the tour y let you know on these week what day I can go sorry.",tourCancellation
"Hi, I have eliminated Santa Rosa from my locations. Pls cancel my appt tomorrow. Thank you",tourCancellation
"Hi, my apologies I am working at the moment. Unfortunately I'm going to have to cancel today's tour. I'm sorry for any inconvenience this causes. I hope to reach out at another time I'm available. Thanks for reaching out.",tourCancellation
"Hi! So sorry, I'm going to have to cancel this tour. I will be out of town the rest of the week. Thanks and apologies for any inconvenience!",tourCancellation
I am canceling the 500pm tour of 555 O’farrell on the 25 of February.,tourCancellation
I am going to have to cancel,tourCancellation
I am sorry I am going to have to cancel.,tourCancellation
I can't make my tour OR I need to cancel OR I won't be able to make it OR Please cancel my tour OR I can't make my tour,tourCancellation
I can't tomorrow I was wondering if you have any available for next Friday,tourCancellation
I can't visit my booked tour. apologies.,tourCancellation
I can't visit my scheduled tour. apologies.,tourCancellation
I cannot visit my booked tour. apologies.,tourCancellation
I cannot visit my scheduled tour. apologies.,tourCancellation
I have to cancel,tourCancellation
I have to cancel my family needs me today,tourCancellation
I have to cancel my tour today,tourCancellation
I have to cancel my virtual tour,tourCancellation
I want to cancel,tourCancellation
I will not visit community on my scheduled tour.,tourCancellation
I won't be able to reach for tour,tourCancellation
I'd like to cancel my tour please,tourCancellation
I'm sorry to say I will be canceling the appointment for the viewing. Thank you for your time.,tourCancellation
Okay thank you. Please cancel for tomorrow.,tourCancellation
please cancel my booked tour. Due to some issue I can't visit,tourCancellation
Please cancel the tour,tourCancellation
Please cancel this tour. Your prices increased and can no longer afford your complex.,tourCancellation
"Sorry about this but I have to cancel this appointment, I used Zillow to contact you but I was on 1490 pine not 1739, not sure why zilliow sent me to this address and not
The unit I was viewing",tourCancellation
Sorry for the inconvenience you can cancel my appointment for Monday I came by there Friday afternoon. The street in front of the apartments stay busy,tourCancellation
"Sorry, I like to cancel the tour.",tourCancellation
1 bed 1 bath with washer dry connects,unitAssignment
1 bedroom & 1 Bathroom whenever it's available,unitAssignment
1 bedroom 1 bathroom,unitAssignment
1 bedroom is fine however if two bedrooms 2 bath are available I want to look at those as well and by april8th if that's too soon then by the end of April no later than,unitAssignment
1 bedroom newly renovated and may 12,unitAssignment
1 bedroom next month,unitAssignment
"1 bedrooms , and 04/02/2022",unitAssignment
"1 person, 2 pets, maximum for rent is what I found listed on apartment list for that apartment which is 960 a month",unitAssignment
1bedroom,unitAssignment
1br for now an would upgrade to a two later,unitAssignment
1st option is good for me,unitAssignment
2 bed 2 bath,unitAssignment
2 bed 2 bath looking good for me,unitAssignment
2 Bed 2 Bath Preferably April 6th,unitAssignment
2 bedrooms,unitAssignment
2 bedrooms and I'm looking to move April 9,unitAssignment
2 bedrooms town home,unitAssignment
2 beds,unitAssignment
2 beds on or before 03/31,unitAssignment
2badrom,unitAssignment
2bdr 2 bath,unitAssignment
2nd option is good for me,unitAssignment
3 bedrooms move in time maybe or June,unitAssignment
"3 beds, 2 baths, and move in date april 21st",unitAssignment
"3, preferably 4 beds/ 2 baths",unitAssignment
3bedroom 2 bath,unitAssignment
5/14/2022 . & 2 beds,unitAssignment
600-800 move in date April 5 1 and 1 pet,unitAssignment
And I would need a 1 bedroom,unitAssignment
And if so how much are they going for?,unitAssignment
"And is this promotion still valid
I sent you an email about it . : $ 2500 REIMBURSEMENT FOR MOVE IN / FURNITURE COST AND NO APPLICATION FEE
Exclusions may",unitAssignment
And my move in date is late may,unitAssignment
Any downstairs and available for move by the 31 or the 1st of April and special anything without carpet,unitAssignment
Any openings for July as for a move in date ? If so we'd be more then happy to apply for the 1bed,unitAssignment
April 29th is my move in date. And two bedrooms one bath,unitAssignment
Are there 1 bedrooms,unitAssignment
could you send me the rent cost?,unitAssignment
Do u have one bedroom apartment available?,unitAssignment
do you have 2 bedroom avablity,unitAssignment
do you have 2/1 availability,unitAssignment
do you have 2x1 bedroom avablity,unitAssignment
"do you have any 3 bedroom
2 bath or 2 bedroom 2 barb available with a washer and dryer connection?",unitAssignment
Do you have any available?,unitAssignment
Do you have any one bedrooms available,unitAssignment
Do you have exact pricing on the units available? Can I see an available 1 and 2 bedroom unit on the tour?,unitAssignment
Do you have one bedroom apartment available,unitAssignment
Do you have rentals other than San Francisco,unitAssignment
For a 1-2 bedroom,unitAssignment
Hello 2300 is to much for me thank you though I am willing to go 2000 if you find anything,unitAssignment
Hello do you have a 2 bdrm and how much,unitAssignment
hello i was wondering the prices and availability,unitAssignment
"Hello I was wondering, how much is the rent there? For two bedrooms",unitAssignment
Hello I'm looking at your website and it's not showing any 2/2 for may or price's how much are your 2/2 and when will it be available?,unitAssignment
"Hello sorry, I'm still looking at apartments, I didn't realize I accidentally submitted something.",unitAssignment
Hello! I was interested To know what the short term lease they have and how much a 1 bedroom would be a month,unitAssignment
Hey I was wondering if you had any 2bedroom 2 baths maybe?,unitAssignment
"Hey so the link provided in the email you sent to me was for a studio apartment. I not interested in that unit. I am interested in the 3 bedroom, apt #312. Is this the unit you are planning to show me? Also the rent for this unit is $2,295/month correct?",unitAssignment
Hey yes I'm interested in the apartment,unitAssignment
"Hi Ryan , what is the price on this place?",unitAssignment
"Hi Ryan, Do you have 1br appartment for 6 months lease? What is the price?",unitAssignment
"Hi Ryan, I have a question. There are two prices listed on both apartments.com and the link in your email. What is the price for the studios ?",unitAssignment
"Hi! I'm still looking for a rental - anything max 1300 with utilities included, either a 1br/studio, and commuting distance to dogpatch",unitAssignment
"Hi. No, I just want two pieces of information. How much is the monthly rent for an apartment for a single person? Do you need credit to be able to rent?",unitAssignment
how much and when can i move in,unitAssignment
How much are your 1 bed rooms going for,unitAssignment
How much are your 2/2 & 3/2,unitAssignment
how much be the rent,unitAssignment
how much do -PRON- cost do -PRON- have -PRON- available on december,unitAssignment
How much do call the 2 bed 1bath,unitAssignment
How much for a 1bedroom 1 bath,unitAssignment
How much for a one bedroom?,unitAssignment
How much for I bed room 1bath,unitAssignment
How much for monthly rent again?,unitAssignment
How much is 3/2,unitAssignment
How much is it,unitAssignment
How much is it to move in,unitAssignment
How much is it?,unitAssignment
How much is that going for,unitAssignment
How much is the rent for a 1br apt?,unitAssignment
How much is the rent for one bedroom,unitAssignment
How much is the rent for the property?,unitAssignment
How much is the rent?,unitAssignment
How much is your one bed,unitAssignment
how much per month,unitAssignment
I am going to be moving to the area within the next month I would like to see what is you guys price range,unitAssignment
I am looking for 2 bedrooms and 2 bathrooms,unitAssignment
I am looking for 2 bedrooms and will move by april 9,unitAssignment
I am looking for 2 beds and 2 baths,unitAssignment
I am looking for 2 beds and two baths,unitAssignment
I am looking for 2bed 2 bath,unitAssignment
I am looking for 3 bedroom,unitAssignment
I am looking for a one bed one bath and my lease is up in May so sometime either before or in the beginning of may,unitAssignment
I am looking for two bedrooms and two bathrooms,unitAssignment
I am looking to move mid-may,unitAssignment
"I am still looking, what are the prices for 2 and 3 bedrooms?",unitAssignment
I like the 2x1 but i wanna look at the 1x1 too,unitAssignment
I need one room apartment and I'm planning to move asap,unitAssignment
I need this studio🥺,unitAssignment
I need to know how much the studios go for?,unitAssignment
I want to see 1 bdrm,unitAssignment
I was looking for at a 1 1/2 bathrooms,unitAssignment
I will let you know later today what day is best for me thanks,unitAssignment
I will want to move ASAP,unitAssignment
I would like to ask how much would it be for a 3bed room,unitAssignment
I would like to know how much is a 2b 2b?,unitAssignment
I would love to see the place.,unitAssignment
I'm looking for 1 bed and 1 bath,unitAssignment
I'm looking for 1 or 2 bed apartment,unitAssignment
I'm looking for a 1 bed 1 bath apartment for the start of may,unitAssignment
I'm looking for a 1 bedroom preferably on the b side,unitAssignment
"I'm looking for a 2BR, 2BA. Is there any available now?",unitAssignment
I'm looking to move in may 1,unitAssignment
I'm looking to see if you have any 3 bedroom 2 bath or 2 bedroom 2 bath with a washer and dryer connection available for immediate move in. and how much would the total move in be if so.,unitAssignment
If not ill take the 2 bedroom,unitAssignment
"If yes, how much is rent ?",unitAssignment
Im looking for 1 bed and 1 bath,unitAssignment
Im out of town working but im relocating in Houston an im looking for an nice quiet area. I would like to know the pricings for 1 bedroom & if they were updated,unitAssignment
Inwould like to know pricing for 2 bedroom floor plans,unitAssignment
Is a bit too early. I have to sell my house in Jersey. I don't know if I should buy or rent.,unitAssignment
Is the 2bd/1ba priced at $980?,unitAssignment
Is there an apartment ready to move in this week?,unitAssignment
It will be me and my 3 kids which are all under 8 years old. I make around $5200 per month but looking for something around or under 1200 a month.,unitAssignment
Just making sure that the property is $1425 a month?,unitAssignment
Just want to know more about the property. What units are available?,unitAssignment
"Kelsey, thank you for reaching out. I am looking for properties that are accepting 3rd party assistance payments.",unitAssignment
"KIPP Zenith 11000 Scott st. Houston, Tx is where my daughter will be attending school. And I’m working 6516 Westheimer rd. Is it possible that you can find some places between these two addresses? So far from the list I like Westchase Preserve, and Briarwood.",unitAssignment
